{
  "$schema": "../../cowork/schemas/task_state.schema.json",
  "task_id": "00000000-0000-0000-0000-000000000000",
  "created_at": "1970-01-01T00:00:00Z",
  "updated_at": "1970-01-01T00:00:00Z",
  "customer_id": "_example_customer",
  "system": "example_cell",
  "task_type": "new_program",
  "status": "intake",
  "intake": null,
  "architect": null,
  "integration": null,
  "safety": null,
  "motion": null,
  "qa": null,
  "documentation": null,
  "conflicts": [],
  "retries": [],
  "handoffs": [],
  "artifacts": []
}
